{"objective_result":"PARTIAL","acceptance":[{"metric":"attack_1_circular_control_fresh_provenance","baseline":"w6 official_tennis_control pooled micro F1@20=0.361111, hFP=0.599089","after":"CONFIRMED-VALID: ARM0 has 20 logged CUDA WASB control runs under w7 paths; ARM0 report/log md5s are in md5_manifest; ARM0 mtime is after w6; ARM4 combined control row matches ARM0 fresh control row. Raw prediction files were not pulled.","target":"Control row came from fresh w7 scoring evidence, not only copied w6 output","verdict":"PASS"},{"metric":"attack_2_checkpoint_provenance","baseline":"A init seed state sha b03eaf59...; C init stage1 state sha 8bc7332e...","after":"CONFIRMED-VALID: A md5 cfda3c423e1f93c0db42f20e32bdae9e; C md5 ba52d39e33bd5a9c1d72c85a1c8cb2a8; both distinct from each other and bases; both have 2372-step loss curves and empty key diffs.","target":"Trained checkpoints distinct, loss curves present, steps == 2372 budget","verdict":"PASS"},{"metric":"attack_3_loso_integrity","baseline":"1121-row w6 corpus md5 target 37a5d43ab537a15bd12d382bb882a5fe","after":"CONFIRMED-VALID: corpus md5 matches; 6 source folds recompute disjoint; outdoor source folds present; w7 scored all 20 per-clip folds for each candidate; excluded frame/label totals are zero.","target":"Fold disjointness, OUTDOOR coverage, no gate-referencing exclusions","verdict":"PASS"},{"metric":"attack_4_contract_check_execution_evidence","baseline":"w5 precedent has vm_contract_tests.log","after":"UNVERIFIABLE: REPORT.md claims the tensor-contract pytest passed, but no non-report stdout/log artifact containing pytest, test_ball_stage2_training, tensor_and_label_geometry, or 20 passed exists under w7_ballretrain_20260709.","target":"Find executed artifact for train/inference tensor-contract assertion","verdict":"FAIL"},{"metric":"attack_5_metric_keys","baseline":"Harness exact keys live under pooled_mixed_metrics.micro_*","after":"CONFIRMED-VALID: acceptance numbers are read from pooled_mixed_metrics.micro_label_f1_at_20px and pooled_mixed_metrics.micro_hidden_false_positive_rate for control/A/C.","target":"Use exact harness keys, not paraphrased statistics","verdict":"PASS"},{"metric":"attack_6_486_anomaly_w5_protocol","baseline":"w5 control/seed scored Burlington + Wolverine, 900 reviewed frames","after":"CONFIRMED-VALID: w7 ARM1 uses the same two sources and 900 reviewed frames; no exclusions; control beats seed in the same direction; W5-to-W7 LoSO-mean F1 drift is under 0.003 for control and seed.","target":"486-anomaly re-run used W5 protocol/folds/corpus identity","verdict":"PASS"},{"metric":"report_and_proof_artifacts","baseline":null,"after":"proof_results.json written by adversarial_verify.py; report.json written under verify lane; schema-specific validator passes.","target":"Self-write lane_report.schema.json report with executable proof paths","verdict":"PASS"}],"changes":["runs/lanes/w7_ballscore_verify_20260709/adversarial_verify.py:1 executable adversarial proof harness for attacks 1-6.","runs/lanes/w7_ballscore_verify_20260709/proof_results.json:1 generated proof output from the harness.","runs/lanes/w7_ballscore_verify_20260709/validate_report_schema.py:1 stdlib schema-shape validator for lane_report.schema.json.","runs/lanes/w7_ballscore_verify_20260709/report.json:1 final lane report."],"full_suite":{"command":".venv/bin/python runs/lanes/w7_ballscore_verify_20260709/adversarial_verify.py --out runs/lanes/w7_ballscore_verify_20260709/proof_results.json; MPLBACKEND=Agg .venv/bin/python -m pytest tests/racketsport/test_ball_stage2_training.py::test_stage2_dataset_tensor_and_label_geometry_use_wasb_official_affine -q; .venv/bin/python runs/lanes/w7_ballscore_verify_20260709/validate_report_schema.py runs/lanes/w7_ballscore_verify_20260709/report.json","passed":3,"failed":0,"skipped":0,"failures_all_preexisting":true,"failure_notes":null},"honest_issues":["Attack 4 is not confirmed: the tensor-contract check may have run on the VM, but the pulled w7 evidence tree does not contain an executable stdout/log artifact proving it.","Attack 1 is bounded: the lean pull excluded raw per-clip control ball_track.json/csv predictions, so the proof relies on logs, mtimes, md5 manifests, and report fingerprints rather than raw prediction checksums.","The control candidate object is byte-identical to w6. That is consistent with deterministic official-anchor scoring, but JSON equality alone cannot distinguish deterministic equality from a copied candidate object.","W7 scoring uses the known w6-inherited 20 per-clip folds, not true 6 source-grouped LoSO. This is protocol-consistent with the dispatch addendum but remains a caveat for future manager rulings.","No repo source files were edited; unrelated dirty worktree changes and protected clips were left untouched."],"next":"Require the retrain lane to provide the missing VM contract-check stdout/log before treating the train/inference tensor assertion as evidence-verified. For the next scoring wave, pull lightweight prediction manifests or checksums for control outputs so copied-vs-fresh provenance does not depend on logs alone.","session_id":null}