{"objective_result":"PARTIAL","acceptance":[{"metric":"Image-package byte binding","baseline":"ZIP was path-bound; SHA-256 absent from provenance contract","after":"Required and verified f1b7ba88084c8664202bf19f73e4704599b46bd42e50e2a6c1a29265cff8b653","target":"Refuse absent, malformed, wrong, or conflicting ZIP SHA","verdict":"PASS"},{"metric":"Per-image digest binding","baseline":"MD5 checked only during initial load","after":"350/350 scratch train/judge entries matched the computed SHA-256 map and staged bytes; 0 mismatches","target":"Every materialized scratch frame byte-bound to its ZIP entry","verdict":"PASS"},{"metric":"job_id fail-open closure","baseline":"Injected wrong job_id was ignored","after":"Export job_id=87 bound as EXPORT_XML_ONLY; conflicting/malformed ledger values refuse","target":"Bind available job IDs and reject injected wrong values","verdict":"PASS"},{"metric":"Decidability fallback","baseline":"No residual declaration","after":"residual_assumptions contains: local CVAT rendered the imported staged bytes for task 87; no independent job-id binding exists in the historical import ledger","target":"Explicitly declare remaining non-cryptographic assumptions","verdict":"PASS"},{"metric":"Adversarial tests","baseline":"18 focused tests","after":"24 passed in 1.23s, covering wrong/absent ZIP SHA, tampered bytes, wrong job_id, and residual presence","target":"All requested adversarial cases pass","verdict":"PASS"},{"metric":"Real production judge","baseline":"split_fix1 lacked Round 2 binding","after":"BALL_CLEAN_JUDGE; train=2,249; validation=167; 350 entry digests verified","target":"Fresh real pipeline run with maximal provenance binding","verdict":"PASS"},{"metric":"Wide-suite no-new-failures gate","baseline":"4,084 passed, 35 failed, 25 skipped","after":"4,190 passed, 32 failed, 25 skipped; 30 common, 5 resolved, 2 current-only BALL arc budget failures that passed 2/2 in isolation","target":"No current-only failures in the full suite","verdict":"FAIL"}],"changes":["[build_ball_regroup_split.py](/Users/arnavchokshi/Desktop/pickleball/scripts/racketsport/build_ball_regroup_split.py:78): pinned the image ZIP and added strict ZIP/job provenance validation.","[build_ball_regroup_split.py](/Users/arnavchokshi/Desktop/pickleball/scripts/racketsport/build_ball_regroup_split.py:1295): re-verifies every materialized scratch frame against the ZIP-entry SHA-256 map.","[test_build_ball_regroup_split.py](/Users/arnavchokshi/Desktop/pickleball/tests/racketsport/test_build_ball_regroup_split.py:454): added the requested adversarial and fallback tests.","[split_fix2/report.json](/Users/arnavchokshi/Desktop/pickleball/runs/lanes/ball_b0_split_20260721/split_fix2/report.json:1): recorded the fresh BALL_CLEAN_JUDGE and residual assumption.","[report_fix2.json](/Users/arnavchokshi/Desktop/pickleball/runs/lanes/ball_b0_split_20260721/report_fix2.json:1): recorded the schema-valid Round 2 report."],"full_suite":{"command":"MPLBACKEND=Agg .venv/bin/python -m pytest tests/racketsport --junitxml=runs/lanes/ball_b0_split_20260721/wide_suite_fix2.junit.xml -q","passed":4190,"failed":32,"skipped":25,"failures_all_preexisting":false,"failure_notes":"30 failures match wide_suite_fix1. Five prior exporter failures resolved. Two current-only BALL arc segment-budget failures passed 2/2 immediately in isolation. The owned splitter module passed 24/24."},"honest_issues":["The recorded full suite contains two current-only failure identities, so the literal no-new-wide-failure gate is unmet.","The suite remains non-green with 32 failures.","The historical ledger has no independent job_id; this remains explicitly declared for orchestrator judgment.","BALL remains ball_verified=false; BALL_CLEAN_JUDGE certifies the data judge, not model accuracy.","Unrelated dirty worktree changes were preserved."],"next":"The orchestrator should rule on the declared residual and the two isolated-pass/full-run BALL arc budget flakes.","session_id":null}