{"objective_result":"BLOCKED","acceptance":[{"metric":"BALL_FAMILY_SPOOF contract","baseline":"CLI slot could manufacture BALL identity","after":"Exact BALL schema/source/world-frame, WASB upstream source, SHA/path/media/PTS provenance, canonical rebuild, nested-lineage refusal, and immutable snapshots enforced","target":"All spoof variants hard-refuse","verdict":"PASS"},{"metric":"Audio artifact contract","baseline":"CLI slot supplied family identity","after":"Exact schema-v1 racketsport_audio_onsets/audio_onset_pop_v2/video_audio_pop_v2 contract required","target":"Only real audio-v2 artifacts accepted","verdict":"PASS"},{"metric":"DUPLICATE_EVENT_ID_ALIAS","baseline":"Duplicate IDs could reuse distant cues","after":"Unique nonempty strings required; coercion collisions refused; matching uses internal indices and rechecked deltas","target":"All duplicate and alias probes refuse","verdict":"PASS"},{"metric":"NULL_DURATION_GAMING","baseline":"Changing duration_s could flip beats_null","after":"Period derives from verified PTS; 1000s and 9.96s declarations refuse; rounding-only changes cannot affect null results","target":"Declared duration cannot control the null","verdict":"PASS"},{"metric":"FRAME_TIMES_IDENTITY_OMISSION","baseline":"Missing media identity passed","after":"Exact type/count/PTS/media declaration required; declared and staged media identities recorded separately","target":"Missing or conflicting identity refuses","verdict":"PASS"},{"metric":"Audio-only rows accepted","baseline":"292","after":"0","target":"0","verdict":"PASS"},{"metric":"Corrected real-evidence recount","baseline":"1,481","after":"1,189 (773 kink-only + 416 both)","target":"1,189","verdict":"PASS"},{"metric":"Required weights","baseline":null,"after":"Kink-only=0.25; both+null-pass=0.5; both+null-fail=0.25; audio-only=0.0","target":"0.25 / 0.5 / 0.25 and no audio-only acceptance","verdict":"PASS"},{"metric":"Audio-null policy","baseline":"No fail-closed support doctrine","after":"20 deterministic unique shifts, |offset| >= 1s, minimum support=2, singleton weight-ineligible","target":"K=20 with explicit support policy","verdict":"PASS"},{"metric":"C parity, determinism, publication","baseline":"Count-only parity and sequential publication","after":"Exact non-placebo parity, byte-identical outputs, exclusive writer reservation, completion-last replacement, and SHA self-verification","target":"Exact parity and deterministic atomic publication","verdict":"PASS"},{"metric":"Focused adversarial suite","baseline":"12 passed","after":"74 passed, 0 failed, 0 skipped","target":"All focused tests pass","verdict":"PASS"},{"metric":"Focused plus related suites","baseline":"50 tests","after":"112 passed, 0 failed, 0 skipped","target":"No related regressions","verdict":"PASS"},{"metric":"CLI contract","baseline":"Frozen VM invocation","after":"Parser flags and invocation unchanged","target":"No flag changes","verdict":"PASS"},{"metric":"Wide no-new-failure proof","baseline":"30 exact failures proven pre-existing","after":"4,185 passed, 31 failed, 25 skipped; one additional flight-simulator timing failure was not proven pre-existing","target":"Every failure proven pre-existing","verdict":"FAIL"},{"metric":"Real retained-VM BALL compatibility","baseline":null,"after":"Frame-time contracts are compatible, but the six raw upstream BALL paths and required media/frame-times declarations were not pulled for verification","target":"Every real VM artifact passes strict preflight","verdict":"FAIL"},{"metric":"Structured report","baseline":"report_fix1.json missing","after":"Schema-valid BLOCKED report written; SHA-256 bdb1c180f83672e90bc1c4137ebdef7328ea0b696b99e5e7ca49f4595db36209","target":"Schema-valid report_fix1.json","verdict":"PASS"}],"changes":["/Users/arnavchokshi/Desktop/pickleball/scripts/racketsport/build_abc_arm_manifests.py:112,342,547,651 — exact input contracts, authenticated WASB provenance, immutable derivation snapshots, canonical rebuild, and SHA checks.","/Users/arnavchokshi/Desktop/pickleball/scripts/racketsport/build_abc_arm_manifests.py:971,1010,1060,1143 — strict event identities, internal-index matching, delta recheck, and PTS-derived deterministic null.","/Users/arnavchokshi/Desktop/pickleball/scripts/racketsport/build_abc_arm_manifests.py:1474,1726 — exact B/C parity and exclusive completion-last publication.","/Users/arnavchokshi/Desktop/pickleball/tests/racketsport/test_abc_arm_manifests.py:371,769,822,910,992,1022,1065,1090,1119,1147,1173,1189,1208,1217,1237,1282,1342 — 74 focused regressions covering all review findings and invariants.","/Users/arnavchokshi/Desktop/pickleball/runs/lanes/abc_audiofix_20260721/report_fix1.json:1 — schema-valid fix-round report."],"full_suite":{"command":"MPLBACKEND=Agg .venv/bin/python -m pytest tests/racketsport -q","passed":4185,"failed":31,"skipped":25,"failures_all_preexisting":false,"failure_notes":"Completed in 3,712.92s. Thirty proven pre-existing nodes recurred: test_compare_court_proposals.py::test_compare_img1605_partial_labels_rejects_current_bad_proposal; twelve test_court_finding_technology_benchmark.py nodes; test_court_keypoint_no_tap_eval.py::test_build_report_includes_img1605_partial_visible_gate; test_court_keypoint_partial_labels.py::test_img1605_progress_builds_partial_visible_label_payload; three test_court_keypoint_review_server.py nodes; two test_court_partial_geometry.py nodes; test_event_head_eval.py::test_public_eval_persists_probability_maxima_and_nonfinite_count; test_overlapping_court_calibration_eval.py::test_lm_homography_report_scores_reviewed_full_labels_without_claiming_verified; three test_review_input_server.py nodes; two test_sam3dbody_persistent_worker.py nodes; test_scaffold_tool_index.py::test_real_scaffold_tool_index_matches_checked_in_schema; and two test_truthful_capabilities.py storage-policy nodes. The additional tests/racketsport/test_flight_simulator.py::test_generate_corpus_is_deterministic_and_fast_for_small_cpu_sample missed its 5.0s threshold at 5.306s. Its dependencies are unchanged and three isolated reruns passed, so it is plausibly environmental but not proven pre-existing. The former court-training timeout passed."},"honest_issues":["The wide-suite no-new-failure target is unmet because the flight-simulator timing miss is outside the proven 30-node baseline.","The retained VM’s six raw BALL tracks were not pulled. Their ball_track_source paths, SHA values, staged-media declarations, and frame-times declarations require hard VM preflight; missing identity must block the rebuild.","No real VM B/C rebuild was run after these changes. VERIFIED remains 0.","No branch or commit was created; unrelated dirty-worktree changes were preserved."],"next":"On the retained VM, preflight every ball_track_source path/SHA, require schema_version=1 and source=wasb, and require exact staged media and frame-times identities. Stop on any omission. Then use a new empty ABC_OUT and run unchanged:\n.venv/bin/python scripts/racketsport/build_abc_arm_manifests.py \\\n  --teacher-manifest \"$CORPUS_OUT/manifest.json\" \\\n  --output-dir \"$ABC_OUT\" --seed 20260720 \\\n  --media \"$VIDEO_ID=$MEDIA_PATH\" \\\n  --frame-times \"$VIDEO_ID=$FRAME_TIMES_PATH\" \\\n  --audio-onsets \"$VIDEO_ID=$AUDIO_ONSETS_PATH\" \\\n  --ball-velocity-kinks \"$VIDEO_ID=$BALL_KINKS_PATH\"\nRepeat each per-video path flag once per train clip. Do not train from the existing abc_out.","session_id":null}