{"objective_result":"PARTIAL","acceptance":[{"metric":"EV2-R4: zero-read final-step recipe lock","baseline":"Divergent settings could reach an input read before rejection.","after":"PASS: complete recipe validation is the first final-step action. Executable tests cover 16 divergent values, four absent values, legacy defaults, omitted CLI values, and assert zero input opens.","target":"Typed rejection before any input artifact read.","verdict":"PASS"},{"metric":"EV2-F3: complete firing-rate inventory","baseline":"Inventory accepted an unregistered manifest-conditioned distribution.","after":"PASS: RATE_MEDIA_LOCK.json pins exactly 38 train and two validation files, their hashes, 8/8/19/3 source distribution, 57,025 frames, and 2063.1827083333333 seconds. Synthetic execution rejects the 35/1/1/1 adversary.","target":"Complete label-independent inventory with executable enforcement.","verdict":"PASS"},{"metric":"EV2-F4: Stage-F optimizer wall","baseline":"The final optimizer update could exceed the registered cap.","after":"PASS: immediate post-optimizer enforcement aborts with typed exit 31. Controlled-clock test passes at 59.999 seconds and aborts at 60.0.","target":"Abort at the registered mining-plus-optimizer wall before guards.","verdict":"PASS"},{"metric":"EV2-F5: frozen-commit byte proof","baseline":"Preflight used working-tree checks and omitted formal artifacts.","after":"PASS: preflight hashes committed CODE_SHA256SUMS and every listed target through git show. Temporary-git execution proves working-tree independence and rejects stale committed sums.","target":"Prove all reviewed bytes are in RUN_COMMIT.","verdict":"PASS"},{"metric":"EV2-F6: complete teardown routes","baseline":"Pre-ID and stale-state failure routes lacked complete deletion confirmation.","after":"PASS: fresh controller state, pre-create arming, atomic ID capture, and both pre-ID and identity-bound delete-and-confirm routes are enforced by fake-provider tests.","target":"Every post-create failure deletes and confirms VM/disk absence.","verdict":"PASS"},{"metric":"EV2-F9: atomic PASS-only handoff","baseline":"The handoff heredoc crashed after creating a temporary file.","after":"PASS: PASS evidence is checked first; output is written and fsynced to a temporary, atomically replaced, and directory-fsynced. Non-PASS execution publishes nothing and production state remains untouched.","target":"Atomic manager-applied handoff with no partial mutation.","verdict":"PASS"},{"metric":"Focused E-v2 and repair suites","baseline":"Several round-1 tests were presence-only.","after":"101 passed in 49.39 seconds; repair boundary file alone: 38 passed in 14.83 seconds. All 13 VM Bash fences parse; judge diff remains empty.","target":"Focused suite and executable boundary tests green.","verdict":"PASS"},{"metric":"Canonical wide racketsport suite","baseline":"Latest manager log stopped during collection with 11 BestStackManifestError errors.","after":"Not rerun after the report because the requested post-report tree freeze is now in effect. Latest recorded result remains 0 tests run and 11 collection errors, not proven pre-existing on this final tree.","target":"Full tests/racketsport suite green or every failure proven pre-existing.","verdict":"FAIL"}],"changes":["scripts/racketsport/finetune_event_head.py:1524 adds exact SHA-locked 38+2 media validation; :2255 adds zero-read recipe enforcement; :2448 and :2990 enforce the post-optimizer cap.","tests/racketsport/test_event_head_ev2_repair.py:203 adds executable adversarial boundary coverage for all six findings; test_finetune_event_head_ev2.py adds direct-CLI legacy-default rejection.","runs/lanes/trackD_ev2_design_20260722/RATE_MEDIA_LOCK.json freezes exact media paths, hashes, source counts, frames, and durations.","REGISTRATION.md, VM_RUN_PLAN.md, INPUT_LOCK.json, CODE_SHA256SUMS, and CONTROL_RESULTS.json now match the repaired implementation. The manager addendum was not modified.","Repair report: runs/lanes/trackD_ev2_design_20260722/report_repair2.json. GPU handoff: runs/lanes/trackD_ev2_design_20260722/VM_RUN_PLAN.md.","CROSS-SIGNAL: consumes ball_velocity_kink/audio_onset agreement families, pb.vision timestamps, and owner labels; feeds ball-3D anchors, rally segmentation, sequence_dp eligibility, and pending Track-B audio late fusion.","BEST-STACK DELTA: none. The lane only emits a disabled PENDING manager handoff after a future GPU PASS; VERIFIED=0 remains binding."],"full_suite":{"command":"MPLBACKEND=Agg .venv/bin/python -m pytest tests/racketsport/","passed":0,"failed":11,"skipped":0,"failures_all_preexisting":false,"failure_notes":"Latest manager canonical run stopped during collection with 11 BestStackManifestError instances for missing tracking.player_selection_layer. It predates the final repair-2 freeze, so the failures are not claimed pre-existing. Focused final result: 101 passed, 0 failed, 0 skipped."},"honest_issues":["Overall result is PARTIAL solely because the canonical wide suite is not green or proven pre-existing on the final frozen tree.","The storage-policy audit remains red from unrelated shared-worktree large-file state.","No training, GPU run, owner-41/protected-50 scoring, or promotion occurred. VERIFIED=0 remains binding.","The frozen judge files were not edited and remain byte-identical to E1 commit 9bbd8011828631b4cc7df4afdf3b1932e758914a.","The report passed JSON validation and the owned diff passed git diff --check. No filesystem edits were made afterward."],"next":"Run the same reviewer's unmodified residual harness and the canonical wide suite on the frozen tree. Make no further lane edits unless the manager issues another repair ruling.","session_id":null}