{"objective_result":"PASS","acceptance":[{"metric":"Worked timebase example","baseline":"teacher frame 67 incorrectly reused as source frame 67","after":"2.233333s maps to encoded source frame 134 at 60fps and decodes successfully","target":"source frame ~134, not 67","verdict":"PASS"},{"metric":"Encoded-PTS mapping","baseline":"fps-based frame arithmetic","after":"nearest-PTS test maps irregular-clock frame 61 instead of nominal frame 62","target":"always map through timestamps to nearest encoded PTS","verdict":"PASS"},{"metric":"Holdout leakage","baseline":"918 holdout events leaked into teacher_event_context.jsonl","after":"0 training-eligible derivative rows across all 3 permanent holdout IDs","target":"0","verdict":"PASS"},{"metric":"Immutable lineage splits","baseline":"video-ID-only assignment","after":"10 content-addressed sources split 7 train / 2 val / 1 test using video ID plus MANIFEST SHA lineage","target":"no lineage straddling","verdict":"PASS"},{"metric":"Teacher confidence and UNKNOWN handling","baseline":"294 sub-0.5 events lost confidence and became hard labels/background risk","after":"294 retained, weight-zero, UNKNOWN-masked low-confidence events; 4,343 additional events masked pending agreement","target":"all uncertain events ignored, never background","verdict":"PASS"},{"metric":"Frozen pseudo weights","baseline":"optional/unfrozen policy","after":"0 / 0.25 / 0.5 for 0 / 1 / >=2 independent audio-or-wrist agreements","target":"exact frozen weighting policy","verdict":"PASS"},{"metric":"Builder totals","baseline":"unsafe 4,637-event corpus","after":"10 sources; 2,839 HIT; 1,798 BOUNCE; 4,637 staged events; 0 training-eligible","target":"deterministic, fail-closed totals","verdict":"PASS"},{"metric":"Determinism","baseline":"scoped in-memory evidence only","after":"5/5 principal real artifacts byte-identical across final rebuilds","target":"byte-identical rebuild","verdict":"PASS"},{"metric":"Affected test suite","baseline":null,"after":"25 passed, 0 failed, 0 skipped","target":"full affected suite green","verdict":"PASS"}],"changes":["scripts/racketsport/build_pbvision_event_corpus.py:46 permanently denylists all three compare-only IDs and freezes A/B/C weighting.","scripts/racketsport/build_pbvision_event_corpus.py:422 maps teacher timestamps through encoded PTS, with explicit provisional conversion for missing media.","scripts/racketsport/build_pbvision_event_corpus.py:645 assigns splits from immutable content-addressed lineage.","scripts/racketsport/build_pbvision_event_corpus.py:791 emits source/export/CV/builder/filtering provenance and explicit holdout eligibility.","scripts/racketsport/build_pbvision_event_corpus.py:820 retains confidence, emits per-frame UNKNOWN masks, and segregates compare-only contexts.","scripts/racketsport/build_pbvision_event_corpus.py:1056 preserves provenance and denylist in the fail-closed filtered derivative.","scripts/racketsport/build_pbvision_event_corpus.py:1093 documents the exact VM agreement procedure; line 1150 emits the manager loader hunk.","tests/racketsport/test_pbvision_event_corpus.py:176 adds irregular encoded-PTS verification; lines 195 and 222 cover the worked example and real decode.","tests/racketsport/test_pbvision_event_corpus.py:279 tests content lineage/provenance; lines 311, 342, and 376 test UNKNOWN masks, all-three holdout denial, and fail-closed loader staging.","runs/lanes/pbv_corpus_rebuild_20260720/manifest.json:1 regenerated corpus; SHA-256 2b7d1acdc0ce71becbfc92732f2659f157d0b7db83f0af6e0d6a7d04eb4919ed.","runs/lanes/pbv_corpus_rebuild_20260720/ABC_STAGE.md:1 and LOADER_CHANGE_REQUIRED.diff:1 record the frozen downstream procedure and unapplied manager hunk.","runs/lanes/pbv_corpus_rebuild_20260720/REPORT.md:1 records acceptance evidence, hashes, verification, and binding blockers."],"full_suite":{"command":"MPLBACKEND=Agg .venv/bin/python -m pytest tests/racketsport/test_pbvision_event_corpus.py tests/racketsport/test_event_head_dataset.py tests/racketsport/test_event_head_finetune.py tests/racketsport/test_finetune_event_head.py -q","passed":25,"failed":0,"skipped":0,"failures_all_preexisting":false,"failure_notes":null},"honest_issues":["The corpus remains VERIFIED=0, training_ready=false, with zero training-eligible teacher events.","Nine eligible sources still require SHA-checked media staging and encoded-PTS verification.","The independent audio/wrist agreement pass has not run; the filtered training manifest intentionally has zero rows.","datasets.py and finetune_event_head.py remain untouched per the concurrent-lane fence. The required UNKNOWN-mask integration hunk is in LOADER_CHANGE_REQUIRED.diff and must be adapted and tested by the manager.","Fresh ULTRA re-review remains mandatory before any A/B/C training use.","The storage-policy audit fails because the task-required 59MB local decode source data/pbv_replay_20260720/xkadsq9bli3h/max.mp4 is untracked and not allowlisted. Scaffold indexing and dead-code audits pass.","No commit was created."],"next":"Stage and PTS-verify the remaining nine MP4s, run the documented audio/wrist agreement pass, integrate and test the loader hunk, then submit the complete artifacts for ULTRA re-review before training.","session_id":"019f827a-027f-7f42-ad6d-72a981c69551"}