{"objective_result":"PASS","acceptance":[{"metric":"Root-cause archaeology","baseline":"Suspected source drift from 0e81c9300 or 737ced8ff.","after":"737ced8ff added the writer arguments and matching Core initializer/schema support atomically; 0e81c9300 did not touch either sidecar file. The failure used a stale Xcode Build/Products PickleballCore module.","target":"Identify the exact cause and authoritative contract side.","verdict":"PASS"},{"metric":"NS-01.1 contract alignment","baseline":"Xcode diagnostic exposed the pre-NS-01.1 initializer.","after":"HEAD caller, Core initializer, fixtures, and tests are already aligned. No source change was made because removing the four caller arguments would regress the authoritative contract.","target":"Minimal contract-correct alignment without fixture/schema changes.","verdict":"PASS"},{"metric":"Golden sidecar contract","baseline":"Three landed NS-01.1 fixtures.","after":"6/6 Python contract tests pass; Swift golden and writer tests pass within the full suite.","target":"Schema fixtures remain green.","verdict":"PASS"},{"metric":"Full SwiftPM suite","baseline":"245 tests previously reported green.","after":"245 passed, 0 failed, 1 skipped.","target":"Full suite remains green.","verdict":"PASS"},{"metric":"Xcode build-for-testing attempt","baseline":"Existing DerivedData produced the initializer mismatch.","after":"Exact command and a fresh-/tmp-DerivedData variant both exited 74 during package resolution because sandbox permissions blocked caches and CoreSimulatorService. Read-only DIA/module inspection confirmed stale Xcode build state.","target":"Attempt build; document sandbox blockage for manager-local ruling.","verdict":"PASS"}],"changes":["runs/lanes/ioscapfix_20260710/report.json:1 records the root cause, no-op rationale, verification, honest issues, and best-stack delta. No Capture/Core/schema/fixture source changed."],"full_suite":{"command":"CLANG_MODULE_CACHE_PATH=/tmp/ioscapfix-clang-module-cache SWIFTPM_MODULECACHE_OVERRIDE=/tmp/ioscapfix-swiftpm-module-cache swift test --disable-sandbox --package-path ios --scratch-path /tmp/ioscapfix-swift-build","passed":245,"failed":0,"skipped":1,"failures_all_preexisting":false,"failure_notes":null},"honest_issues":["The exact xcodebuild command was not proven green because the sandbox stopped it before Swift compilation. Manager-local verification with fresh DerivedData remains required.","No source fix was warranted: the committed-file-drift premise is refuted by HEAD and history. The stale DerivedData artifact remains outside the repository.","Unrelated pre-existing worktree changes were preserved.","Best-stack delta (c): none; no model, weights, runtime policy, schema, or selected default changed."],"next":"Run the requested xcodebuild locally with a fresh DerivedData path. Do not remove the four NS-01.1 writer arguments.","session_id":null}