{"objective_result":"PASS","acceptance":[{"metric":"A1 honest partial propagation","baseline":"Exit-0 worker results could become complete/Replay ready","after":"4/4 missing BODY, ball, paddle, and assets fixtures remained partial through worker, DB, and API with missing lists/trust bands intact","target":"4/4 remain partial end-to-end","verdict":"PASS"},{"metric":"A2 advertised URL gate","baseline":"No post-publish every-URL gate","after":"Missing advertised URL detected after upload and degraded to partial","target":"Any absent URL prevents complete","verdict":"PASS"},{"metric":"A3 atomic publication","baseline":"Per-file atomic replacement with manifest last","after":"Simulated kill left no visible bundle or staging residue; directory publication is atomic","target":"No half-visible publish","verdict":"PASS"},{"metric":"A4 stats/coaching ordering","baseline":"Runner writes manifest before match_stats","after":"Stats/coaching stage before manifest; late stats are excluded and force partial","target":"Ordering enforced by code and test","verdict":"PASS"},{"metric":"A5 requested wide suites","baseline":"Six known localhost-bind sandbox failures","after":"3426 passed, 6 pre-existing socket failures, 24 skipped; final focused verification also passed 43/43","target":"Zero new failures; socket-only failures listed","verdict":"PASS"}],"changes":["server/bundle_policy.py: added the single fail-closed minimum-bundle and worker-report policy.","server/pipeline_invocation.py: added recursive verified staging, stats/coaching-before-manifest ordering, and atomic directory publication.","server/worker/daemon.py: added pre/post-upload policy evaluation and complete|partial|failed propagation.","server/routes/worker.py: persisted honest status, missing capabilities, and trust bands without Replay-ready upgrades.","server/routes/jobs_v2.py: added owner-scoped S3 manifest/artifact delivery with URL rewriting.","server/render_app.py and server/gpu_runner.py: routed local/SSH-facing results through the same policy.","tests/server/test_ns015_bundle_policy.py: added complete, four missing-capability, missing-URL, kill, ordering, late-stats, and legacy-exit coverage.","runs/lanes/ns015_statuspack_20260710/report.json: schema-valid final report; handoff.md contains forbidden runner/app inline hunks; wide_suite.xml contains pytest evidence."],"full_suite":{"command":"MPLBACKEND=Agg .venv/bin/python -m pytest tests/racketsport tests/server -q --junitxml=runs/lanes/ns015_statuspack_20260710/wide_suite.xml","passed":3426,"failed":6,"skipped":24,"failures_all_preexisting":true,"failure_notes":"All six are unchanged localhost-bind tests failing with PermissionError [Errno 1]: three test_court_keypoint_review_server cases and three test_review_input_server cases. The lane touched neither implementation and the sandbox explicitly forbids binds. Manager must re-verify locally."},"honest_issues":["Product-wide NS-01.5 still needs the forbidden runner and native-app hunks in handoff.md applied by their owners.","Ten legacy tests/render_service tests outside the specified suite still encode retired exit-success=>complete behavior or use empty fake complete bundles. They require fixture/contract migration, not a weaker policy.","No physical app, SSH worker, GPU, or live S3 reproduction was possible or claimed; manager retains live parity verification.","Storage audit retains its existing allowlisted-source failure, with zero unknown large files.","(c) NO stack delta: infrastructure only. VERIFIED=0 remains binding."],"next":"Integration owner should re-derive the runner/Swift hunks, migrate stale render_service fixtures, then run the six socket tests locally and one real local/SSH worker-to-app trace.","session_id":null}