{"objective_result":"PARTIAL","acceptance":[{"metric":"Round 4 deciding verdict","baseline":"Rules 7–8 absent at bd9fb1eb","after":"ADOPT_COMMIT; 0 findings","target":"Correct wording with no fresh contradictions","verdict":"PASS"},{"metric":"Rule 7 shared-manifest lock","baseline":"No fleet-wide manifest lock","after":"Exclusive coordinator-controlled writer authorization with dispatch declaration","target":"Prevent concurrent shared-manifest writers","verdict":"PASS"},{"metric":"Rule 8 suite manifest guard","baseline":"No start/end manifest integrity check","after":"sha256 mismatch invalidates the run before red-booking or attribution","target":"Compose correctly with rules 5–6","verdict":"PASS"},{"metric":"Delta boundary","baseline":"bd9fb1eb","after":"SKILL.md +9/-0, containing only rules 7–8","target":"Bounded Round 4 delta","verdict":"PASS"},{"metric":"Report schema","baseline":null,"after":"Validated against docs/racketsport/lane_report.schema.json","target":"Schema-valid report.json","verdict":"PASS"}],"changes":["runs/lanes/trackE_methodrules_review_20260722/review_fix3.json:1 — added ADOPT_COMMIT verdict and exact four-file authorization.","runs/lanes/trackE_methodrules_review_20260722/report.json:1 — overwrote with the schema-valid Round 4 report."],"full_suite":{"command":"NOT RERUN BY BOUNDED ROUND 4; recorded lane command: MPLBACKEND=Agg .venv/bin/python -m pytest tests/racketsport -q --junitxml=runs/lanes/trackE_methodrules_20260722/wide_postchange.junit.xml","passed":4432,"failed":43,"skipped":25,"failures_all_preexisting":false,"failure_notes":"Historical shared-working-tree iteration evidence only; Round 4 did not reopen attribution or promote this run."},"honest_issues":["The deciding verdict is ADOPT_COMMIT, but objective_result remains PARTIAL because the historical suite has 43 failures not proven pre-existing.","The historical suite remains iteration-only, not promotion evidence.","VERIFIED=0 remains binding.","review_fix3.json is ignored and requires explicit force-add when staging."],"next":"Track E may commit only: .claude/skills/run-lane/SKILL.md, runs/lanes/trackE_methodrules_review_20260722/spec.md, review_fix3.json, and report.json.","session_id":null}