{"objective_result":"PARTIAL","acceptance":[{"metric":"CPU smoke training","baseline":null,"after":"Exit 0; 30 finite steps; mean loss 0.9264→0.4577; checkpoint and manifest written","target":"≥30 steps, finite losses, last-five loss below first-five","verdict":"PASS"},{"metric":"Public and protected evaluation","baseline":null,"after":"Both exit 0; protected 50-row evaluation correctly stamped; HIT/BOUNCE F1=0.0 at k=1/2","target":"Both evaluations exit 0 with tolerance sweeps and protected-data safeguards","verdict":"PASS"},{"metric":"Dataloader/inference parity","baseline":null,"after":"Identical tensors for one real decoded sample; focused tests exit 0","target":"Byte-identical preprocessing tensors","verdict":"PASS"},{"metric":"Fixture fine-tune and provenance guards","baseline":null,"after":"Fine-tune exit 0; bootstrap/protected-overlap/duplicate-ID exits 21/22/23","target":"Fixture succeeds; all prohibited provenance cases fail typed nonzero","verdict":"PASS"},{"metric":"Builder determinism","baseline":null,"after":"Builder exits 0/0; cmp exit 0; universes reconcile to 33,791/4,271/36,484","target":"Byte-identical manifests with exact inventory reconciliation","verdict":"PASS"},{"metric":"Hygiene and wide suite","baseline":"Known stale storage allowlist and sandbox bind restrictions; concurrent lanes active","after":"Hygiene 0/0/1 with no new storage violations; wide suite exit 1: 3733 passed, 10 failed, 24 skipped","target":"No unresolved full-suite failures","verdict":"FAIL"}],"changes":["threed/racketsport/event_head/datasets.py:1 — unified on-the-fly public and reviewed-data loaders with source-disjoint splits and masks.","threed/racketsport/event_head/model.py:1 — compact MobileNetV3-small plus GRU event head and masked loss.","threed/racketsport/event_head/matcher.py:1 — typed NMS, greedy matching, tolerance sweeps, and timing metrics.","scripts/racketsport/build_event_head_dataset.py:1 — deterministic manifest builder.","scripts/racketsport/train_event_head.py:1 — bounded CPU smoke trainer.","scripts/racketsport/eval_event_head.py:1 — public and protected-seed evaluation CLI.","scripts/racketsport/finetune_event_head.py:1 — guarded owner-review fine-tune CLI.","tests/racketsport/test_event_head_dataset.py:1 — determinism, reconciliation, offset, split, and parity tests.","tests/racketsport/test_event_head_finetune.py:1 — fixture fine-tune and typed hard-failure tests.","third_party/VENDOR_PINS.md:13 — pinned E2E-Spot reference at edec4201471beed631bed374bd0b95fcdc8a2f4f.","runs/lanes/event_head_scaffold_20260716/smoke_evidence.md:1 — complete command and exit-code evidence.","runs/lanes/event_head_scaffold_20260716/report.json:1 — mandatory structured lane report."],"full_suite":{"command":"MPLBACKEND=Agg .venv/bin/python -m pytest tests/racketsport -q","passed":3733,"failed":10,"skipped":24,"failures_all_preexisting":false,"failure_notes":"Exit 1. Managed-sandbox bind denials: three test_court_keypoint_review_server tests, three test_review_input_server tests, and two test_sam3dbody_persistent_worker tests. test_flight_simulator.py::test_generate_corpus_is_deterministic_and_fast_for_small_cpu_sample took 8.079s versus 5s and reproduced isolated at 7.327s; this lane did not modify flight code. test_scaffold_tool_index.py::test_real_scaffold_tool_index_matches_checked_in_schema failed because concurrent untracked build_event_head_anchor_candidates.py has unknown category. That concurrent failure is not proven pre-existing, so PASS is not claimed."},"honest_issues":["Random-init zero-shot transfer is zero: HIT and BOUNCE F1 are 0.0 at both tolerances. The 0.0 negative false-positive rate reflects no predictions above threshold, not useful accuracy.","The wide suite remains red, so smoke gate 6 and the overall objective are not complete.","The upstream jhong93 train/val clips straddle parent broadcasts. canonical_split is preserved, while actual train/val assignment groups entire parents deterministically; some canonical clip assignments necessarily change.","The public evaluation is only a three-window execution slice, not accuracy evidence.","ImageNet-weight loading exists and fails loudly offline, but was not exercised with downloaded weights.","The real owner-reviewed file remains absent; only the schema-exact synthetic fixture was fine-tuned.","No frame cache was created. Lane artifacts total 15 MiB and the committed-only vendor reference totals 23 MiB.","BEST-STACK DELTA: (c) no stack delta. No promotion or best_stack.json change; a future GPU checkpoint requires its own PENDING models/MANIFEST.json entry."],"next":"The concurrent anchor-candidate lane must register its CLI category, then the integration owner should rerun the full suite in an environment permitting socket binds and meeting the flight timing budget. Do not promote the smoke checkpoint.","session_id":null}