{"objective_result":"PASS","acceptance":[{"metric":"Producer hashes","baseline":"Audio/BALL producers lacked mandatory media/PTS identities.","after":"Both emit media SHA plus exact PTS-source SHA identities; fixtures pass.","target":"Real producers satisfy the materializer hash contract.","verdict":"PASS"},{"metric":"Runbook overwrite","baseline":"Materializer regenerated stale VM_ABC_RUN.md.","after":"Import/write path removed; full materialization preserves the runbook byte-for-byte.","target":"Materializer never writes VM_ABC_RUN.md.","verdict":"PASS"},{"metric":"Owner-41 evaluator","baseline":"No executable owner-val mode or gate-complete output.","after":"Deterministic owner-val emits per-arm/seed F1@±2, negFP, timing-p90, firing rate, and step fields.","target":"Executable owner_102 val evaluation for all nine arms.","verdict":"PASS"},{"metric":"One-touch race guard","baseline":"rg exit 2 proceeded and ledger check raced the claim.","after":"Permanent mkdir claim with explicit rg 0/1/>=2 handling; all branches tested.","target":"Atomic, fail-closed one-touch claim.","verdict":"PASS"}],"changes":["PRODUCER HASHES FIXED — [audio CLI](/Users/arnavchokshi/Desktop/pickleball/scripts/racketsport/build_audio_onsets_v2.py:38), [audio payload](/Users/arnavchokshi/Desktop/pickleball/threed/racketsport/audio_onsets_v2.py:481), and [BALL payload](/Users/arnavchokshi/Desktop/pickleball/threed/racketsport/ball_inflections.py:232).","RUNBOOK OVERWRITE FIXED — [materializer](/Users/arnavchokshi/Desktop/pickleball/scripts/racketsport/build_abc_arm_manifests.py:837) writes no runbook; [regression](/Users/arnavchokshi/Desktop/pickleball/tests/racketsport/test_abc_arm_manifests.py:388).","OWNER-41 MODE FIXED — [evaluator](/Users/arnavchokshi/Desktop/pickleball/scripts/racketsport/eval_event_head.py:220) and [synthetic test](/Users/arnavchokshi/Desktop/pickleball/tests/racketsport/test_eval_event_head.py:35).","ONE-TOUCH RACE FIXED — [runbook](/Users/arnavchokshi/Desktop/pickleball/runs/lanes/w1b_abc_loader_20260721/VM_ABC_RUN.md:209) and [three-branch test](/Users/arnavchokshi/Desktop/pickleball/tests/racketsport/test_abc_runbook.py:25).","[Lane report](/Users/arnavchokshi/Desktop/pickleball/runs/lanes/w1e_abc_chain_20260721/report.json:1) written. No commit created."],"full_suite":{"command":"MPLBACKEND=Agg .venv/bin/python -m pytest -q tests/racketsport/test_audio_onsets_v2.py tests/racketsport/test_ball_inflections.py tests/racketsport/test_abc_arm_manifests.py tests/racketsport/test_eval_event_head.py tests/racketsport/test_abc_runbook.py","passed":31,"failed":0,"skipped":0,"failures_all_preexisting":false,"failure_notes":null},"honest_issues":["VERIFIED=0 remains binding; this is fixture/synthetic executable-chain proof, not an accuracy promotion.","No judge/protected artifact, protected scorer, GPU training, or wide suite was opened or run.","Storage audit still flags unrelated pre-existing untracked data/pbv_replay_20260720/xkadsq9bli3h/max.mp4; scaffold and dead-code audits pass."],"next":"Gate round-4 can inspect the four fenced hunks; protected-50 remains untouched.","session_id":null}