{"objective_result":"PASS","acceptance":[{"metric":"1. Manifest/body mesh provenance read and contract identified","baseline":"Current body_mesh_index/replay_viewer_manifest expose body_mesh_url/body_mesh_index_url/mesh_status but no per-frame trust-band field in existing frames.","after":"Viewer parses optional per-mesh-frame `trust_badge` carrying trust_band.py vocabulary (`verified | preview | low_confidence`) from body mesh index metadata and legacy body_mesh frames.","target":"Identify current provenance path and exact viewer/pipeline field contract.","verdict":"PASS"},{"metric":"2. Absent-field fail-safe","baseline":"Existing artifacts have no per-frame mesh trust field and render with current solid material.","after":"Absent `trust_badge` maps to the exact same material as today; invalid present values fail parsing. Pipeline half should emit `trust_badge: \"preview\"` for human_review-tier mesh frames.","target":"No behavior change when field is absent; documented exact key for pipeline lane.","verdict":"PASS"},{"metric":"3. Ghost/estimated styling","baseline":"All body meshes used the same solid green material.","after":"`preview` renders amber estimated translucent material with opacityScale 0.62; `low_confidence` renders gray estimated translucent material with opacityScale 0.42; neither is hidden or solid-colored.","target":"human_review-tier frames get visually distinct translucent estimated styling.","verdict":"PASS"},{"metric":"4. Viewer tests and suite","baseline":"New tests failed before implementation: material export missing and decoded trust_badge was undefined.","after":"Focused tests pass: 117 passed. Full `web/replay` verification passes: npm test 233 passed, typecheck exit 0, build exit 0.","target":"Unit tests for tier->material including absent fail-safe; existing viewer suite green.","verdict":"PASS"}],"changes":["/Users/arnavchokshi/Desktop/pickleball/web/replay/src/viewerData.ts:112 adds optional `trust_badge` to body mesh frame types.","/Users/arnavchokshi/Desktop/pickleball/web/replay/src/viewerData.ts:805 parses and validates optional `trust_badge` with trust-band vocabulary.","/Users/arnavchokshi/Desktop/pickleball/web/replay/src/viewerData.ts:1962 propagates `trust_badge` from body mesh index frames into decoded renderable mesh frames.","/Users/arnavchokshi/Desktop/pickleball/web/replay/src/viewerData.ts:2557 preserves least-trusted `trust_badge` across generated interpolation frames.","/Users/arnavchokshi/Desktop/pickleball/web/replay/src/App.tsx:342 adds exported `bodyMeshMaterialForTrustBadge` mapping with absent-field solid fail-safe and estimated styling.","/Users/arnavchokshi/Desktop/pickleball/web/replay/src/App.tsx:2366 applies per-frame trust material to `SolidBodyMesh` without hiding estimated meshes.","/Users/arnavchokshi/Desktop/pickleball/web/replay/src/App.test.tsx:103 adds material mapping tests for absent, verified, preview, and low_confidence.","/Users/arnavchokshi/Desktop/pickleball/web/replay/src/viewerData.test.ts:1325 asserts body_mesh_index frame metadata carries `trust_badge` through decode.","/Users/arnavchokshi/Desktop/pickleball/runs/lanes/w7_ghostviewer_20260709/report.json:1 writes the lane report artifact."],"full_suite":{"command":"cd web/replay && npm test && npm run typecheck && npm run build","passed":233,"failed":0,"skipped":0,"failures_all_preexisting":false,"failure_notes":null},"honest_issues":["No localhost/browser visual QA was run in this sandbox; the manager's post-land zoomed live browser check remains required.","BEST-STACK DELTA: expected none and actual none. This was display-only viewer styling with no runtime/default knob and no edit to `configs/racketsport/best_stack.json`.","The pipeline half still must emit per-mesh-frame `trust_badge`; current body mesh artifacts do not carry it."],"next":"Pipeline lane should emit `trust_badge: \"preview\"` on human_review-tier body mesh index frames, then manager should run the zoomed browser visual check.","session_id":null}