{"objective_result":"PASS","acceptance":[{"metric":"Protected scan first","baseline":null,"after":"NO_MATCH for all 4 forbidden identifiers; export MD5 982a1aea754610da67cd653ee51373d2","target":"NO_MATCH proof and MD5 before ingest","verdict":"PASS"},{"metric":"TOTAL CORPUS N / 3k decision","baseline":"1,750 rows","after":"2,388 rows (+638); checkpoint does not fire; 612 rows short","target":"Truthfully determine the 3,000-row checkpoint","verdict":"PASS"},{"metric":"Full ingest accounting","baseline":"640 job_21 images","after":"638 added; 2 skipped: 1 same-box duplicate, 1 conflicting duplicate; 0 multi-ball frames","target":"Every image added or skipped by reason","verdict":"PASS"},{"metric":"Class/source/visibility accounting","baseline":"1,240 positive / 510 negative","after":"1,828 positive / 560 negative; per-source counts recorded; visibility recorded only as uninformative accounting","target":"Complete accounting under owner rulings","verdict":"PASS"},{"metric":"Deterministic corpus revision","baseline":"MD5 0bb2fc592361f2e9246a71701617c3e5","after":"MD5 0ae65f014ce26b2ddf8573427c60853d; all 40 files and both manifests byte-identical on rerun","target":"Deterministic next revision","verdict":"PASS"},{"metric":"LoSO manifest","baseline":"1,750 rows, 6 source folds","after":"2,388 unique rows; 6/6 complete and disjoint; 5 OUTDOOR folds","target":"All-disjoint proof with OUTDOOR fold","verdict":"PASS"},{"metric":"GPU re-score preparation","baseline":"38-clip ballingest2 pattern","after":"40 clips: prior 38 plus 2 new; new corpus paths, W7_EXTRA_CANDIDATES and true source groups; bash -n passed; not dispatched","target":"Prepare-only refreshed block","verdict":"PASS"},{"metric":"BEST-STACK DELTA","baseline":"Pre-existing dirty best_stack.json","after":"None from this lane","target":"No best-stack change","verdict":"PASS"},{"metric":"Focused verification","baseline":null,"after":"12 passed; artifact and report structural validation passed","target":"Green MPLBACKEND=Agg focused suite","verdict":"PASS"}],"changes":["runs/lanes/w7_ballingest3_20260709/reviewed_corpus/:1 generated the 2,388-row corpus.","runs/lanes/w7_ballingest3_20260709/corpus_md5_manifest.json:1 recorded corpus MD5 0ae65f014ce26b2ddf8573427c60853d.","runs/lanes/w7_ballingest3_20260709/loso_fold_manifest.json:1 recorded six disjoint source folds.","runs/lanes/w7_ballingest3_20260709/ingest_report.json:1 preserved full converter accounting.","runs/lanes/w7_ballingest3_20260709/determinism_proof.json:1 recorded protected, provenance, session-match and rerun proof.","runs/lanes/w7_ballingest3_20260709/GPU_RESCORE_COMMANDS.sh:1 added the prepare-only 40-clip refresh.","runs/lanes/w7_ballingest3_20260709/report.json:1 wrote the structured lane report."],"full_suite":{"command":"MPLBACKEND=Agg .venv/bin/python -m pytest tests/racketsport/test_owner_ball_label_ingest.py tests/racketsport/test_ball_loso_validation.py -q","passed":12,"failed":0,"skipped":0,"failures_all_preexisting":true,"failure_notes":null},"honest_issues":["The 3,000-row checkpoint cannot fire: the corpus is 2,388 rows, 612 short.","Two export images were skipped as duplicates; one conflicted with an existing reviewed row and did not overwrite it.","The generic job_21 filename prevents converter filename-based session lookup; independent content reconciliation uniquely matches ball_session_03.","w6 visibility values remain uninformative and must not be used for visibility-conditioned analysis or weighting.","No GPU scoring or retraining ran; BALL remains SCAFFOLD/not VERIFIED.","The environment lacks jsonschema, so report validation used a schema-specific structural validator."],"next":"Do not fire the 3k checkpoint. Ingest at least 612 additional net-new reviewed rows, then recompute the threshold; keep the GPU block prepare-only until authorized.","session_id":null}