{"objective_result":"PARTIAL","acceptance":[{"metric":"Reviewed corpus reconciliation","baseline":"3,026 lineage-unclassified reviewed rows","after":"3,026/3,026 classified: corrected_prelabel=1,028; confirmed_prelabel=1,998","target":"3,026/3,026","verdict":"PASS"},{"metric":"Historical lineage counts by source","baseline":null,"after":"73VurrTKCZ8=397 (271 corrected,126 confirmed); Ezz6HDNHlnk=400 (280,120); HyUqT7zFiwk=560 (228,332); _L0HVmAlCQI=554 (64,490); wBu8bC4OfUY=555 (147,408); zwCtH_i1_S4=560 (38,522)","target":"397,400,560,554,555,560 respectively","verdict":"PASS"},{"metric":"Real scratch export ingestion","baseline":"Pending during initial lineage reconciliation","after":"350/350 images ingested; export SHA-256 fea4b9529a4020ee577c5702478753fa4ea84f99c51a9e3ef16e87e96d7fc104","target":"350/350","verdict":"PASS"},{"metric":"Scratch counts by source","baseline":null,"after":"73VurrTKCZ8=27; Ezz6HDNHlnk=67; HyUqT7zFiwk=100; _L0HVmAlCQI=34; wBu8bC4OfUY=60; zwCtH_i1_S4=62","target":"350 total; HyU=100 and Ezz=67","verdict":"PASS"},{"metric":"Parent-source split","baseline":"Old per-clip LoSO semantics","after":"train=2,249 (2,066 old + 183 scratch) over four sources; validation=167 scratch (HyU=100, Ezz=67); train/validation source intersection=0","target":"2,066 old + 183 scratch train; 167 validation; no source overlap","verdict":"PASS"},{"metric":"Judge lineage purity","baseline":"Contaminated blended evaluation","after":"167/167 validation rows are scratch; confirmed_prelabel evaluation rows=0; HyU and Ezz metric fields emitted separately","target":"Every evaluation row scratch; confirmed_prelabel never evaluation","verdict":"PASS"},{"metric":"Confirmed-prelabel policy","baseline":null,"after":"1,546 included train rows carry weight=0.25, ground_truth=false, evaluation_eligible=false","target":"Train-only at explicit low weight","verdict":"PASS"},{"metric":"Historical/scratch duplicate rows","baseline":null,"after":"0 shared row keys","target":"0","verdict":"PASS"},{"metric":"Protected collision scan","baseline":"Old 35-frame sample","after":"0 collisions across 350 candidates versus all 2,953 protected frames/additions (600+300+1,151+900 video frames plus 2 additions)","target":"0 against every protected frame","verdict":"PASS"},{"metric":"Input SHA-256 contracts","baseline":null,"after":"reviewed ingest=c4200032e86f912d68adfefdb27118e48b2ed0673fee6122a21df638c601968d; package=a04fd956ac56c16130643a79344c21298dec6a3e69f507e0788e996a927a9a55","target":"Exact supplied hashes","verdict":"PASS"},{"metric":"Focused synthetic suite","baseline":"5 tests in initial implementation","after":"7 passed; covers three lineage classes, parent-source separation, all-frame collision refusal, invalid provenance, determinism, and CLI failure verdict","target":"All focused tests green","verdict":"PASS"},{"metric":"BEST-STACK delta","baseline":"No requested change","after":"None","target":"None","verdict":"PASS"},{"metric":"Branch/commit policy","baseline":"main","after":"Remained on main; no branch or commit created","target":"main; no commits","verdict":"PASS"},{"metric":"Mandatory wide suite","baseline":"Earlier same-day artifact had 30 failures","after":"4,067 passed, 31 failed, 25 skipped in 4,679.72s","target":"Full tests/racketsport green","verdict":"FAIL"}],"changes":["scripts/racketsport/build_ball_regroup_split.py:177 added deterministic parent-source split construction and hard BALL_NO_CLEAN_JUDGE gates.","scripts/racketsport/build_ball_regroup_split.py:378 added export-pending lineage-only reconciliation.","scripts/racketsport/build_ball_regroup_split.py:608 added exact package provenance, hash, row-key, ordinal, ZIP-member, source-count, and dimension reconciliation.","scripts/racketsport/build_ball_regroup_split.py:777 added strict CVAT Images 1.1 export parsing and geometry validation.","scripts/racketsport/build_ball_regroup_split.py:896 added exhaustive decoded-pixel SHA-256 plus 64-bit perceptual-hash collision checking over every protected frame.","tests/racketsport/test_build_ball_regroup_split.py:313 added seven synthetic splitter/refusal/determinism tests.","runs/lanes/ball_b0_split_20260721/split/report.json:1 emitted BALL_CLEAN_JUDGE report; SHA-256 122e65913d54df6be6c3e5c6ca91229fc17d207674edc7a31ea705bafd6eb3a3.","runs/lanes/ball_b0_split_20260721/split/lineage_rows.jsonl:1 emitted 3,376 unique lineage rows.","runs/lanes/ball_b0_split_20260721/split/train.jsonl:1 emitted 2,249 source-safe training rows.","runs/lanes/ball_b0_split_20260721/split/validation.jsonl:1 emitted 167 scratch-only evaluation rows.","runs/lanes/ball_b0_split_20260721/wide_suite.junit.xml:1 recorded the complete wide-suite result."],"full_suite":{"command":"MPLBACKEND=Agg .venv/bin/python -m pytest tests/racketsport --junitxml=runs/lanes/ball_b0_split_20260721/wide_suite.junit.xml -q","passed":4067,"failed":31,"skipped":25,"failures_all_preexisting":false,"failure_notes":"31 failures: 18 court-fixture/current-data failures across test_compare_court_proposals, 12 test_court_finding_technology_benchmark cases, test_court_keypoint_no_tap_eval, test_court_keypoint_partial_labels, 2 test_court_partial_geometry cases, and test_overlapping_court_calibration_eval; 8 sandbox socket-bind failures across 3 test_court_keypoint_review_server cases, 3 test_review_input_server cases, and 2 test_sam3dbody_persistent_worker cases; test_event_head_eval failed with StopIteration; test_flight_simulator exceeded its 5s limit at 8.62s; test_scaffold_tool_index found three unrelated unknown CLIs (the B0 CLI is categorized BALL and has a direct test); 2 test_truthful_capabilities storage checks found unrelated holdout_eval/PBV artifacts. The B0 test module had no failures. Twenty-eight failure identities match an earlier same-day wide-suite artifact, but three are current-only, so failures_all_preexisting remains false."},"honest_issues":["The mandatory wide suite is non-green: 31 failures. Therefore the global lane result is PARTIAL despite every B0-specific gate passing.","The storage-policy audit fails on six tracked holdout_eval artifacts and one untracked PBV replay file outside this lane.","HyU/Ezz metric fields are intentionally null: B0 built the clean judge but did not score models or use a GPU.","BALL remains ball_verified=false; this is data/judge infrastructure, not a model or product promotion.","The worktree contains substantial unrelated dirty work that this lane preserved."],"next":"Route the 31 wide-suite failures to their owning court, sandbox, EVENT, performance, scaffold, and storage lanes, then rerun the same wide command. The real 167-row scratch judge is ready for B2 as scoped B0 evidence, subject to the manager’s global-suite policy.","session_id":null}